{
  "description": "ORGANIZER with an empty address is the empty string, not an absence",
  "kind": "parse",
  "ics": "BEGIN:VEVENT\r\nUID:u1\r\nORGANIZER:mailto:\r\nEND:VEVENT",
  "expect": {
    "events": [
      {
        "uid": "u1",
        "recurrenceId": null,
        "summary": null,
        "description": null,
        "location": null,
        "start": null,
        "end": null,
        "allDay": false,
        "status": null,
        "organizer": "",
        "attendees": [],
        "rrule": null,
        "dtstamp": null
      }
    ]
  }
}
