{
  "description": "SUMMARY is not trimmed",
  "kind": "parse",
  "ics": "BEGIN:VEVENT\r\nUID:u1\r\nSUMMARY:  spaced  \r\nEND:VEVENT",
  "expect": {
    "events": [
      {
        "uid": "u1",
        "recurrenceId": null,
        "summary": "  spaced  ",
        "description": null,
        "location": null,
        "start": null,
        "end": null,
        "allDay": false,
        "status": null,
        "organizer": null,
        "attendees": [],
        "rrule": null,
        "dtstamp": null
      }
    ]
  }
}
