{
  "description": "UID is trimmed",
  "kind": "parse",
  "ics": "BEGIN:VEVENT\r\nUID:  u1  \r\nSUMMARY:x\r\nEND:VEVENT",
  "expect": {
    "events": [
      {
        "uid": "u1",
        "recurrenceId": null,
        "summary": "x",
        "description": null,
        "location": null,
        "start": null,
        "end": null,
        "allDay": false,
        "status": null,
        "organizer": null,
        "attendees": [],
        "rrule": null,
        "dtstamp": null
      }
    ]
  }
}
