{
  "description": "an unknown property is ignored",
  "kind": "parse",
  "ics": "BEGIN:VEVENT\r\nUID:u1\r\nX-CUSTOM-THING:whatever\r\nSEQUENCE:3\r\nSUMMARY:Kept\r\nEND:VEVENT",
  "expect": {
    "events": [
      {
        "uid": "u1",
        "recurrenceId": null,
        "summary": "Kept",
        "description": null,
        "location": null,
        "start": null,
        "end": null,
        "allDay": false,
        "status": null,
        "organizer": null,
        "attendees": [],
        "rrule": null,
        "dtstamp": null
      }
    ]
  }
}
