{
  "description": "a capital N escape is a newline",
  "kind": "parse",
  "ics": "BEGIN:VEVENT\r\nUID:u1\r\nSUMMARY:a\\Nb\r\nEND:VEVENT",
  "expect": {
    "events": [
      {
        "uid": "u1",
        "recurrenceId": null,
        "summary": "a\nb",
        "description": null,
        "location": null,
        "start": null,
        "end": null,
        "allDay": false,
        "status": null,
        "organizer": null,
        "attendees": [],
        "rrule": null,
        "dtstamp": null
      }
    ]
  }
}
