{
  "description": "an I-with-dot-above before mailto: does not shift the address",
  "kind": "parse",
  "ics": "BEGIN:VEVENT\r\nUID:u1\r\nORGANIZER;CN=İstanbul:mailto:jane@example.com\r\nEND:VEVENT",
  "expect": {
    "events": [
      {
        "uid": "u1",
        "recurrenceId": null,
        "summary": null,
        "description": null,
        "location": null,
        "start": null,
        "end": null,
        "allDay": false,
        "status": null,
        "organizer": "jane@example.com",
        "attendees": [],
        "rrule": null,
        "dtstamp": null
      }
    ]
  }
}
