{
  "description": "VALUE=DATE-TIME does not set allDay",
  "kind": "parse",
  "ics": "BEGIN:VEVENT\r\nUID:u1\r\nDTSTART;VALUE=DATE-TIME:20260601T090000Z\r\nEND:VEVENT",
  "expect": {
    "events": [
      {
        "uid": "u1",
        "recurrenceId": null,
        "summary": null,
        "description": null,
        "location": null,
        "start": "20260601T090000Z",
        "end": null,
        "allDay": false,
        "status": null,
        "organizer": null,
        "attendees": [],
        "rrule": null,
        "dtstamp": null
      }
    ]
  }
}
