{
  "description": "a colon inside a quoted parameter splits the line, per §9 divergence 1",
  "kind": "parse",
  "ics": "BEGIN:VEVENT\r\nUID:u1\r\nSUMMARY;CN=\"a:b\":actual\r\nEND:VEVENT",
  "expect": {
    "events": [
      {
        "uid": "u1",
        "recurrenceId": null,
        "summary": "b\":actual",
        "description": null,
        "location": null,
        "start": null,
        "end": null,
        "allDay": false,
        "status": null,
        "organizer": null,
        "attendees": [],
        "rrule": null,
        "dtstamp": null
      }
    ]
  }
}
