{
  "description": "a line with no colon keeps its semicolon in the name, so it selects no member",
  "kind": "parse",
  "ics": "BEGIN:VEVENT\r\nUID:u1\r\nSUMMARY;LANGUAGE=en\r\nEND:VEVENT",
  "expect": {
    "events": [
      {
        "uid": "u1",
        "recurrenceId": null,
        "summary": null,
        "description": null,
        "location": null,
        "start": null,
        "end": null,
        "allDay": false,
        "status": null,
        "organizer": null,
        "attendees": [],
        "rrule": null,
        "dtstamp": null
      }
    ]
  }
}
