{
  "description": "an ATTENDEE with an empty address contributes nothing",
  "kind": "parse",
  "ics": "BEGIN:VEVENT\r\nUID:u1\r\nATTENDEE:mailto:\r\nATTENDEE:mailto:real@example.com\r\nEND:VEVENT",
  "expect": {
    "events": [
      {
        "uid": "u1",
        "recurrenceId": null,
        "summary": null,
        "description": null,
        "location": null,
        "start": null,
        "end": null,
        "allDay": false,
        "status": null,
        "organizer": null,
        "attendees": [
          "real@example.com"
        ],
        "rrule": null,
        "dtstamp": null
      }
    ]
  }
}
